{
  "$schema": "https://json-schema.org/draft/2020-12/schema",
  "$id": "https://vgccoach.com/schemas/battle-state-v1.schema.json",
  "title": "VGC Coach battle state v1",
  "description": "A runtime-neutral record of observed Pokemon Champions battle evidence. Omitted values are unknown and must not be inferred.",
  "type": "object",
  "additionalProperties": false,
  "required": [
    "schema_version",
    "format_provenance",
    "battle",
    "teams"
  ],
  "properties": {
    "schema_version": {
      "const": "battle-state-v1"
    },
    "format_provenance": {
      "$ref": "#/$defs/formatProvenance"
    },
    "battle": {
      "$ref": "#/$defs/battleIdentity"
    },
    "teams": {
      "type": "object",
      "additionalProperties": false,
      "required": ["self", "opponent"],
      "properties": {
        "self": {"$ref": "#/$defs/team"},
        "opponent": {"$ref": "#/$defs/team"}
      }
    },
    "turn_events": {
      "type": "array",
      "default": [],
      "items": {"$ref": "#/$defs/turnEvent"}
    },
    "revealed_information": {
      "type": "array",
      "default": [],
      "items": {"$ref": "#/$defs/revealedFact"}
    },
    "outcome": {
      "$ref": "#/$defs/outcome"
    }
  },
  "$defs": {
    "httpUrl": {
      "type": "string",
      "format": "uri",
      "pattern": "^https?://(?:(?:[A-Za-z0-9](?:[A-Za-z0-9-]{0,61}[A-Za-z0-9])?)(?:\\.(?:[A-Za-z0-9](?:[A-Za-z0-9-]{0,61}[A-Za-z0-9])?))*|\\[[0-9A-Fa-f:.]+\\])(?::(?:[0-9]{1,4}|[1-5][0-9]{4}|6[0-4][0-9]{3}|65[0-4][0-9]{2}|655[0-2][0-9]|6553[0-5]))?(?:/(?:[A-Za-z0-9._~!$&'()*+,;=:@-]|%[0-9A-Fa-f]{2})*)*(?:\\?(?:[A-Za-z0-9._~!$&'()*+,;=:@/?-]|%[0-9A-Fa-f]{2})*)?(?:#(?:[A-Za-z0-9._~!$&'()*+,;=:@/?-]|%[0-9A-Fa-f]{2})*)?$",
      "description": "An RFC 3986 absolute lowercase HTTP(S) URI with no userinfo, raw whitespace or controls, backslashes, malformed percent escapes, malformed host, extra fragment delimiters, or out-of-range explicit port."
    },
    "rfc3339DateTime": {
      "type": "string",
      "format": "date-time",
      "pattern": "^(?!0000-)[0-9]{4}-(?:0[1-9]|1[0-2])-(?:0[1-9]|[12][0-9]|3[01])[Tt](?:[01][0-9]|2[0-3]):[0-5][0-9]:(?:[0-5][0-9]|60)(?:\\.[0-9]+)?(?:[Zz]|[+-](?:[01][0-9]|2[0-3]):[0-5][0-9])$"
    },
    "side": {
      "type": "string",
      "enum": ["self", "opponent"]
    },
    "battleSide": {
      "type": "string",
      "enum": ["self", "opponent", "field"]
    },
    "pokemonRef": {
      "type": "object",
      "additionalProperties": false,
      "required": ["species_id"],
      "properties": {
        "species_id": {
          "type": "string",
          "pattern": "^[a-z0-9]+(?:-[a-z0-9]+)*$"
        },
        "form_id": {
          "type": ["string", "null"],
          "pattern": "^[a-z0-9]+(?:-[a-z0-9]+)*$"
        },
        "nickname": {"type": "string"}
      }
    },
    "actorRef": {
      "type": "object",
      "additionalProperties": false,
      "required": ["side"],
      "properties": {
        "side": {"$ref": "#/$defs/side"},
        "species_id": {
          "type": "string",
          "pattern": "^[a-z0-9]+(?:-[a-z0-9]+)*$"
        },
        "form_id": {
          "type": ["string", "null"],
          "pattern": "^[a-z0-9]+(?:-[a-z0-9]+)*$"
        },
        "position": {
          "type": "string",
          "enum": ["left", "right", "bench", "unknown"]
        }
      }
    },
    "formatProvenance": {
      "type": "object",
      "additionalProperties": false,
      "required": [
        "game",
        "battle_mode",
        "regulation_id",
        "official_source_url",
        "verified_at"
      ],
      "properties": {
        "game": {"type": "string", "enum": ["pokemon-champions"]},
        "battle_mode": {"type": "string", "enum": ["doubles"]},
        "regulation_id": {"type": "string", "pattern": "^regulation-[a-z0-9-]+$"},
        "official_source_url": {"$ref": "#/$defs/httpUrl"},
        "verified_at": {"$ref": "#/$defs/rfc3339DateTime"},
        "active_window": {
          "type": "object",
          "additionalProperties": false,
          "required": ["start", "end"],
          "properties": {
            "start": {"$ref": "#/$defs/rfc3339DateTime"},
            "end": {"$ref": "#/$defs/rfc3339DateTime"}
          }
        }
      }
    },
    "playerSide": {
      "type": "object",
      "additionalProperties": false,
      "required": ["side"],
      "properties": {
        "side": {"$ref": "#/$defs/side"},
        "player_id": {"type": ["string", "null"]},
        "display_name": {"type": ["string", "null"]}
      }
    },
    "battleIdentity": {
      "type": "object",
      "additionalProperties": false,
      "required": ["source_type", "player_sides"],
      "properties": {
        "source_type": {
          "type": "string",
          "enum": ["manual_transcription", "structured_notes", "adapter_output"]
        },
        "source_url": {"$ref": "#/$defs/httpUrl"},
        "source_id": {"type": "string"},
        "occurred_at": {"$ref": "#/$defs/rfc3339DateTime"},
        "best_of": {"type": "integer", "enum": [1, 3]},
        "game_number": {
          "type": "integer",
          "minimum": 1,
          "description": "When best_of is also present, the CLI requires game_number to be no greater than best_of."
        },
        "player_sides": {
          "type": "array",
          "minItems": 2,
          "maxItems": 2,
          "uniqueItems": true,
          "items": {"$ref": "#/$defs/playerSide"}
        }
      }
    },
    "team": {
      "type": "object",
      "description": "The CLI treats a Pokemon identity as species_id plus form_id and requires active and bench to be disjoint.",
      "additionalProperties": false,
      "required": ["preview_roster"],
      "properties": {
        "preview_roster": {
          "type": "array",
          "maxItems": 6,
          "uniqueItems": true,
          "items": {"$ref": "#/$defs/pokemonRef"}
        },
        "selected": {
          "type": "array",
          "maxItems": 4,
          "uniqueItems": true,
          "items": {"$ref": "#/$defs/pokemonRef"}
        },
        "active": {
          "type": "array",
          "maxItems": 2,
          "uniqueItems": true,
          "items": {"$ref": "#/$defs/pokemonRef"}
        },
        "bench": {
          "type": "array",
          "maxItems": 4,
          "uniqueItems": true,
          "items": {"$ref": "#/$defs/pokemonRef"}
        }
      }
    },
    "eventDetail": {
      "type": "object",
      "additionalProperties": false,
      "properties": {
        "identifier": {"type": "string", "pattern": "^[a-z0-9]+(?:-[a-z0-9]+)*$"},
        "text": {"type": "string"}
      }
    },
    "targetRef": {
      "oneOf": [
        {"$ref": "#/$defs/actorRef"},
        {
          "type": "object",
          "additionalProperties": false,
          "required": ["side"],
          "properties": {
            "side": {"const": "field"}
          }
        }
      ]
    },
    "turnEvent": {
      "type": "object",
      "additionalProperties": false,
      "required": ["turn", "sequence", "side", "kind"],
      "properties": {
        "turn": {"type": "integer", "minimum": 0},
        "sequence": {"type": "integer", "minimum": 1},
        "side": {"$ref": "#/$defs/battleSide"},
        "kind": {
          "type": "string",
          "enum": [
            "turn_start",
            "action",
            "move",
            "switch",
            "damage",
            "heal",
            "status",
            "faint",
            "weather",
            "terrain",
            "ability",
            "item",
            "observation",
            "turn_end",
            "other"
          ]
        },
        "actor": {"$ref": "#/$defs/actorRef"},
        "action": {"$ref": "#/$defs/eventDetail"},
        "target": {"$ref": "#/$defs/targetRef"},
        "result": {"$ref": "#/$defs/eventDetail"},
        "observations": {
          "type": "array",
          "items": {"type": "string"}
        }
      }
    },
    "revealedFact": {
      "type": "object",
      "additionalProperties": false,
      "required": ["turn", "side", "kind", "value", "evidence"],
      "properties": {
        "turn": {"type": "integer", "minimum": 0},
        "side": {"$ref": "#/$defs/side"},
        "kind": {
          "type": "string",
          "enum": ["move", "item", "ability", "stat_clue", "other"]
        },
        "species_id": {
          "type": "string",
          "pattern": "^[a-z0-9]+(?:-[a-z0-9]+)*$"
        },
        "value": {"type": "string", "minLength": 1, "pattern": "[^\\u0009-\\u000D\\u001C-\\u0020\\u0085\\u00A0\\u1680\\u2000-\\u200A\\u2028\\u2029\\u202F\\u205F\\u3000\\uFEFF]"},
        "evidence": {"type": "string", "minLength": 1, "pattern": "[^\\u0009-\\u000D\\u001C-\\u0020\\u0085\\u00A0\\u1680\\u2000-\\u200A\\u2028\\u2029\\u202F\\u205F\\u3000\\uFEFF]"}
      }
    },
    "outcome": {
      "type": "object",
      "description": "result is from the self side's perspective: win/self, loss/opponent, draw/null; incomplete and unknown may omit winner or use null.",
      "additionalProperties": false,
      "required": ["result"],
      "properties": {
        "result": {
          "type": "string",
          "enum": ["win", "loss", "draw", "incomplete", "unknown"]
        },
        "winner": {
          "type": ["string", "null"],
          "enum": ["self", "opponent", null]
        },
        "reason": {"type": ["string", "null"]}
      },
      "oneOf": [
        {
          "required": ["result", "winner"],
          "properties": {
            "result": {"const": "win"},
            "winner": {"const": "self"}
          }
        },
        {
          "required": ["result", "winner"],
          "properties": {
            "result": {"const": "loss"},
            "winner": {"const": "opponent"}
          }
        },
        {
          "required": ["result", "winner"],
          "properties": {
            "result": {"const": "draw"},
            "winner": {"const": null}
          }
        },
        {
          "required": ["result"],
          "properties": {
            "result": {"const": "incomplete"},
            "winner": {"const": null}
          }
        },
        {
          "required": ["result"],
          "properties": {
            "result": {"const": "unknown"},
            "winner": {"const": null}
          }
        }
      ]
    }
  }
}
